{
  "rulepack_id": "completion_workflow",
  "version": "1.0.0",
  "title": "Completion Workflow Rules",
  "purpose": "Define the gates required before an AI-assisted task can be reported complete.",
  "applies_to": [
    "all_tasks",
    "final_responses",
    "handoff"
  ],
  "rules": [
    {
      "id": "completion.documentation_gate",
      "severity": "required",
      "statement": "Update affected documentation before reporting completion when behavior, setup, architecture, APIs, data models, configuration, deployment, or workflows change.",
      "scope": [
        "documentation",
        "completion"
      ]
    },
    {
      "id": "completion.changelog_gate",
      "severity": "required",
      "statement": "Update CHANGELOG.md after each completed task or explicitly report why it is not applicable.",
      "scope": [
        "changelog",
        "completion"
      ],
      "validation": {
        "type": "co_changed",
        "when_changed": [
          "**"
        ],
        "ignore": [
          "CHANGELOG.md",
          ".ai/project-map.md",
          ".ai/project-graph.json",
          ".ai/project-graph.svg",
          ".ai/omni-version.json",
          ".ai/context-log.md",
          ".ai/gate-waivers.jsonl",
          ".ai/requirements/**",
          "docs/generated/**"
        ],
        "must_also_change": [
          "CHANGELOG.md"
        ]
      }
    },
    {
      "id": "completion.requirements_registry",
      "severity": "required",
      "statement": "Update the requirements registry when a requirement is added, completed, blocked, or materially changed, using `omni requirement add|update|complete` rather than hand-editing the JSON. `omni gate` fails when changed files have no matching registry change.",
      "scope": [
        "requirements",
        "completion"
      ],
      "validation": {
        "type": "co_changed",
        "when_changed": [
          "**"
        ],
        "ignore": [
          "CHANGELOG.md",
          ".ai/project-map.md",
          ".ai/project-graph.json",
          ".ai/project-graph.svg",
          ".ai/omni-version.json",
          ".ai/context-log.md",
          ".ai/gate-waivers.jsonl",
          ".ai/requirements/**",
          "docs/generated/**"
        ],
        "must_also_change": [
          ".ai/requirements/requirements.json",
          ".ai/requirements/requirements-archive.json"
        ]
      }
    },
    {
      "id": "completion.validation",
      "severity": "required",
      "statement": "Run the most relevant validation available after changes and report command results.",
      "scope": [
        "validation",
        "completion"
      ]
    },
    {
      "id": "completion.rebuild",
      "severity": "required",
      "statement": "Run the configured build or rebuild command before marking implementation complete, or explain why it could not be run.",
      "scope": [
        "validation",
        "build"
      ]
    },
    {
      "id": "completion.failure_status",
      "severity": "required",
      "statement": "If validation or rebuild fails, mark the task needs_review or blocked and include the failing command and relevant error.",
      "scope": [
        "validation",
        "reporting"
      ]
    },
    {
      "id": "completion.no_unvalidated_success",
      "severity": "required",
      "statement": "Do not claim success if validation was skipped; explain why it was not run and identify residual risk.",
      "scope": [
        "reporting"
      ]
    },
    {
      "id": "completion.required_final_fields",
      "severity": "required",
      "statement": "Final output must include summary, completed requirements, pending or blocked requirements, files changed, validation summary, documentation summary, changelog summary, commit entry sentence, and pull request information.",
      "scope": [
        "final_response"
      ]
    },
    {
      "id": "completion.gate_before_completion",
      "severity": "required",
      "statement": "Run `omni gate` before reporting completion and resolve or explicitly waive (`omni waive <rule-id> --reason \"...\"`) every failure it reports. Do not claim completion while it fails.",
      "scope": [
        "completion",
        "validation"
      ]
    },
    {
      "id": "completion.failure_ledger",
      "severity": "required",
      "statement": "When a defect, failed validation or build, reverted change, or user-reported regression is found and fixed, record it in the failure ledger with `omni failure add|update` before reporting completion: the symptom, the root cause (why it happened, not only what changed), the affected files or symbols, the regression test, and the rule or playbook that prevents a repeat. `omni requirement complete` refuses defect, bug, fix and regression requirements that have no ledger entry unless `--no-failure-entry \"<reason>\"` is given, and `omni doctor` fails a fixed entry that lacks a root cause, fix, test-or-reason, or prevention.",
      "scope": [
        "failures",
        "completion",
        "reporting"
      ]
    },
    {
      "id": "completion.regression_test",
      "severity": "required",
      "statement": "Every fixed failure gets a regression test that fails without the fix, named in the ledger's regression_tests so the graph links it to the failure. When no automated test is practical, record an honest no_test_reason instead; a fixed failure with neither is a doctor error. Do not weaken or delete a test to make it pass; if a test was wrong, record that as its own failure.",
      "scope": [
        "failures",
        "testing",
        "completion"
      ]
    },
    {
      "id": "completion.failure_becomes_rule",
      "severity": "required",
      "statement": "A failure that a rule, playbook or checklist should have prevented, or that no instruction covered, must change that rulepack, playbook or checklist in the same task, and the ledger entry must name it in prevention_rules. The goal is that the same class of error is not incorporated again; a repeat of a recorded failure is recorded with recurrence_of and treated as evidence that the earlier prevention was insufficient.",
      "scope": [
        "failures",
        "rules",
        "completion"
      ]
    },
    {
      "id": "completion.rebuild_graph_layers",
      "severity": "recommended",
      "statement": "After adding or changing requirements, changelog entries, tests or failure-ledger entries, rebuild the graph with `omni graph build` so the governance and assurance layers stay traversable, and use `omni graph why <path>` to confirm the new links resolve.",
      "scope": [
        "graph",
        "completion"
      ]
    },
    {
      "id": "completion.verify_target_environment",
      "severity": "recommended",
      "statement": "Verify a command or generated artifact in the environment the user actually runs it in (for example WSL with a Windows browser, an externally-managed system Python, CRLF checkouts), not only the one it was written in, and say in the report which environments were not verified. A defect that only appears in the user's environment is still a defect: record it in the failure ledger.",
      "scope": [
        "validation",
        "reporting",
        "failures"
      ]
    },
    {
      "id": "completion.register_test_suites",
      "severity": "required",
      "statement": "Register every test suite of the project OmniEngineering is embedded in, including validation scripts, smoke checks and end-to-end tests that no naming convention finds: `omni test detect` proposes suites from file contents and CI commands and `omni test add` records the paths, framework, run command and the code each suite covers in the test suite registry. Add a suite when a new test framework, test directory or check script appears, and keep `omni test check` and `omni doctor` clean. The assurance layer describes the project's tests, not OmniEngineering's own tooling.",
      "scope": [
        "testing",
        "completion",
        "graph"
      ]
    },
    {
      "id": "completion.tests",
      "severity": "required",
      "statement": "The registered test suites the change set reaches must pass before completion is reported. `omni gate` runs `omni test run --impacted`, which picks the suites through `omni graph impact` (every suite when no graph exists; nothing to run, and a pass, when no suite is registered) and exits non-zero on any failure or timeout. A rule that passed is memoised on its scoped change set, so the hook does not re-run it until a file the rule watches changes; `omni gate --no-memo` forces it. Waive for one change with `omni waive completion.tests --reason \"...\"`.",
      "scope": [
        "testing",
        "validation",
        "completion"
      ],
      "validation": {
        "type": "command",
        "run": "omni test run --impacted",
        "when_changed": [
          "**"
        ],
        "ignore": [
          ".ai/**",
          "*.md",
          "docs/**"
        ],
        "timeout": 900
      }
    },
    {
      "id": "completion.arbiter_gate",
      "severity": "required",
      "statement": "A change passes Arbiter's own gate (`arbiter gate . --changed <base>` under arbiter.yaml) before it is reported complete.",
      "scope": [
        "completion",
        "validation"
      ],
      "validation": {
        "type": "command",
        "run": "arbiter gate . --changed {base} --profile offline --baseline .arbiter/baseline.json --out arbiter-out/omni-gate --format json,sarif,pr-comment",
        "when_changed": [
          "**"
        ],
        "ignore": [
          ".ai/**",
          "CHANGELOG.md",
          "*.md",
          "docs/**"
        ],
        "timeout": 600
      }
    }
  ]
}
